,review_id,star_rating,review_headline_clean,review_body_clean,compound,neg,neu,pos
524,RPNCLJWGOLNS2,5,exceeds expectation,set issue specifically counter-top use extremely short cord cord even reach far side microwave expect need extension cord unit tiny bit small average much pull door lay flush open may problem large dish i've yet encounter issue internal light turn unit operate door open run lot quieter microwave i've ever see four mode microwave convection oven air fryer toaster oven/grill timer find odd i've use phone long barely notice.<br br setting make super easy use auto-reheat dinner plate casserole single feature convenient popcorn button i've hear story friend without feature try pop bag microwave popcorn six people one microwave viable popcorn problem one button let pop.<br br also auto-cook feature pasta beverage chicken breast frozen breakfast frozen dinner frozen lunch?<br br air fry slim fry however want call feature work well though try homemade french fry work list pre-programmed items:<br br frozen oven chip aka french fries)<br frozen bread prawns<br frozen chicken nuggets<br frozen potato croquettes<br frozen onion rings<br chicken wings<br homemade french fry recipe guide good read first never air fry before)<br potato wedges<br drumsticks<br br use toaster oven grill seem like use term interchangeably put thing want toast/grill high rack include low rack select grill medium dark toast go three minute side come shockingly good toaster low expectation one work really well.<br br overall everything say well,0.891,0.056,0.835,0.108
525,R2PYJM9JEO9E8X,5,tv kitchen,thing awesome look like tv crack bite small microwave term counter-space also bite tall number pad enter specific cook time instead hit start button multiple time add second powerful simple complaint,0.8176,0.057,0.668,0.275
526,R16TWDB4H6WQZK,2,doe's great job popcorn though,noisy end push table door release work use two hand open door one hold move push door release plastic print button cover already start show sign ware week use button hard locate center actually operate doe's great job popcorn though,0.7351,0.067,0.776,0.157
527,R11ZEQ1YNUORO8,5,five star,perfect fit,0.7351,0.0,0.0,1.0
528,RNU6IDOP7BV0Y,5,five star,excellent product service,0.5719,0.0,0.351,0.649
529,R2T6PILHX8VPIR,4,really like microwave bite torn feature,first family happy microwave portion samsung counter top convection microwave look great kitchen stainless steel match major appliance black ceramic interior also nice touch look great easy clean turntable bit large countertop microwave replace operation microwave quiet one downside particular unit powerful microwave rat watts compare watt microwave price range however sufficient home cooking task set power time easy.<br br function we've try convection oven use cook frozen hors d'oeuvres fancy name pig blanket use include metal rack ceramic crusty plate even though preheat oven direct find cook food far longer expect base time list package real time saving use conventional oven addition exterior unit become hot use mode suspect use convection mode often though nice feature have.<br br slim fry grilling combine cook mode try yet i'm sure mode seem use microwave convection heat clear much short include manual also unclear include metal rack crisp plate use even look review question see samsung give inconsistent information subject event take reviewer word slim fry mediocre substitute actual frying grilling grill elements reach back third oven i'm sure worth inevitable mess create try grill oven.<br br overall would give samsung four star microwave cook three star convection cook two star function four star overall since main job well.h inevitable mess create try grill oven overall would give samsung four star microwave cook three star convection cook two star function four star overall since main job well,0.9834,0.042,0.794,0.165
530,R261M5U6WLRFLF,5,five star,good,0.4404,0.0,0.0,1.0
531,R1CNON69VWOU0,5,high quality large,lovely oven also microwave use variety purpose adjunct regular oven microwave.<br br would suggest excellent choice counter top oven microwave make sure counter space quite large vent rear require space could put special shelf microwave vent reason would give star nimble counter hog,0.9231,0.0,0.727,0.273
532,R5THFZT2H51RX,3,three star,work fine get pretty hot,0.6124,0.0,0.375,0.625
533,R32PTFHFWY9S1L,5,five star,beautiful,0.5994,0.0,0.0,1.0
534,R2A8RKJ6X71CKT,1,microwave heat,microwave look nice heat seem like fan blow cold air amazon great return policy however make unfortunate buy easily reverse,0.8957,0.094,0.409,0.497
535,RTSIB49LN0D2L,4,come metal rack next tv without dial,address lead question:<br br yes metal rack work use microwave function universe condense singularity explode else childhood change longer turn dial phone make call drop dime slot call someone payphone?<br br anyway yes metal rack microwave function follow instructions.<br br here's skinny:<br br microwave see description functions--and work pretty close described.<br br that's first real issue box label description webpage they're almost complete instruction manual there's bit overall would like bit term device idea utilize especially concepts/cooking type involve think slim-fry concept great i'd like understand work good chicken wing fries.<br br also note several comment lack timer true br exchange though actually generate crispy crust microwave pizza.<br br drop-down door nice keep mind handle placement countertop drop flush require oven little taller previous microwave.<br br functionally i'd like good option use grill slim-fry setting let grease/food dripping drop onto turntable especially thing get wicked hot reasonable wait pull clean it.<br br function work well that's main thing.<br br all...great oven perfect i've never meet perfect microwave,0.9842,0.06,0.724,0.216
536,R2PFXY2EIZMD3K,3,three star,really good product sometimes turn,0.4927,0.0,0.556,0.444
537,RCM91KQW0NCCG,4,love compact size,love compact size hate fact turntable keep slip base readjust every single time use,0.128,0.186,0.603,0.211
538,R25XMDAE573J22,5,excellent quality value,work great,0.6249,0.0,0.196,0.804
539,R2K45IY0NO70ZI,5,awesome convection microwave oven,microwave find place counter week know much would love heat food quickly easy use review manual serve function microwave toaster oven do.<br br make microwave different...<br many possibilities.<br pizza crispy bottom reheat even microwave setting!<br simple dive stuff do!<br size comparable old cu ft microwave yet more.<br color awesome stainless front make less clean gray top side stainless---so keep cleaner.<br dial quick microwave setting smart reheat something second press button bottom right second twice minute etc press microwave button turn dial time like backwards forward press start button.<br clock set easy set.<br convection oven work setting degree preheat oven first select convection oven need read direction manual first easy navigate out.<br oven include crispy plate two wire rack work great convection set glass plate ring bake cheese onto plate use convection set clean super easy.<br br may concern you...<br microwave need sufficiently power circuit power cord long cord need able place right front outlet go use close it.<br use plastic plate microwave safe one review microwave mistaken--they say use plastic true use microwave safe material there's thorough easy reference list manual locate inside microwave oven unpack it).<br oven heat element top convection oven want make sure microwave safe plastic cover use microwave otherwise go pain clean up.<br br matter address...<br always interest read people's review one reviewer like manual cookbook include honestly i've get many cookbook year appliance i've never use manual oven seem small pack essential information need use it--and recipe guideline cook vegetable reheat food etc cook microwave oven normally bake spinach artichoke dip oven though degree minute come perfectly!<br br another reviewer lament lack timer microwave oven that's true actually use microwave function time count normally use convection set select long want oven cook turn automatically do find need extra minute easy turn right back use convection oven need preheat oven first that's problem one feature awesome take dish oven stir oven start cooking pressed start button time keep go either people know use timer oven use stand alone timer take another room need move hear go off.<br br i'm please microwave cover basic beyond well expect everything--grill slimfry microwave convection fact microwave bake well enough many appliance claim much expect one appliance prefer grill cheese stave fry stave want oven risk clean mess i'm extremely happy i've use far.ics beyond well expect everything--grill slimfry microwave convection fact microwave bake well enough many appliance claim much expect one appliance prefer grill cheese stave fry stave want oven risk clean mess i'm extremely happy i've use far,0.9973,0.045,0.742,0.213
540,RVRMVCPZKM9PT,4,four star,problem yet,-0.4019,0.73,0.27,0.0
541,R3UH2U55T1ZSA4,5,five star,good small functional no-frills oven,0.4404,0.0,0.58,0.42
542,RK8P69Y6XOLSZ,4,described,microwave month i'm still learn use feature two microwave secondary one quiet cook one negative note far item do cooking beep three time open door hit stop beep every minute,-0.7096,0.174,0.826,0.0
543,RSWCOK46I1UAU,5,multi-functional perfect size,decide put chimney exhaust new kitchen bulky range microwave plus never use scratch giant waste space dear handy wood worker husband build new cabinet problem create perfect space counter new small microwave love drop door plus feature incredible slimfry convection grill note samsung mean counter however able provide plenty air circulation problem,0.2732,0.184,0.631,0.185
544,RIVCWT3LM0G2E,5,love little microwave,love little microwave recently sell home live temporarily small one bedroom little counter space find one base review decide buy disappointed work well microwave ever own pleased purchase,0.7269,0.085,0.661,0.253
545,R3IK8LUYPWCU9H,5,i've microwave couple month,i've microwave couple month problem work well,-0.1531,0.276,0.51,0.214
546,R32OZOWQJ0FHI1,5,five star,great money,0.6249,0.0,0.196,0.804
547,R1YCDNKNNDS7W,4,love microwave much,love microwave much aesthetically cool kitchen appliance also pretty powerful say kinda small inside square plate oz coffee cup popcorn bag pose difficulty e.g popcorn bag start fill tray stop turn still trade,0.836,0.104,0.612,0.283
548,R3REJQGN2U5WOQ,1,hit purchase warn,warn stay away microwave look pretty cost read review unreliability ge's poor service expense repair product do purchased product still one-year warranty maybe shot break even stop work month warranty expire warranty appliance nightmare begin service charge ge authorize repairman tell much actually cost repair microwave part labor sure ever cost-justify repair one update ge tell cost effective repair unit offer rebate toward another ge microwave still can't recommend unit,0.1999,0.11,0.783,0.107
549,R37RXWJQ6Q4EAL,5,great microwave,several month use i'm happy report still run strong heat food evenly cold area large enough fit everything cook sleek design color also look nice kitchen,0.9062,0.0,0.641,0.359
550,R14DIBP09XNI5U,3,three star,described,0.0,0.0,1.0,0.0
551,R2VLGWA3RDFYJZ,5,five star,love,0.6369,0.0,0.0,1.0
552,R320MQHTFW6U61,4,great value money everything promise,versatile microwave basic function microwave heat reheat defrost perform excellently unit much come stack part allow heat reheat two plat simultaneously extremely convenient best convection microwave pretty much everything would need microwave bake cake broil etc cook fry item manner limit oiliness like pull door rather open variety function save space actually decently size little small previous microwave much size could need stainless steel great match rest kitchen high-ended look device solid well build good value money everything promise,0.9859,0.0,0.658,0.342
553,R2NOED2XUPTMI7,5,great microwave,great unit use semi work wonderfully well great size shape compact area would definately recommend unit,0.9493,0.0,0.397,0.603
554,R23S0G0SVPC0I8,5,easy cooking,easy install video instruction require get see get install unit run fine issue,0.5719,0.0,0.701,0.299
555,R9MZ0TK5X4RG8,5,happy,love microwave small need wow great extra feature beautiful beyond happy yes small need use can't get large dinner plate get small one love back round sharp half pint finally die yrs way feature sharp little counter space thank goodness find yes pricey well worth money update purchase die april whirlpool nice send replacement,0.9856,0.088,0.442,0.469
556,R1V8PH2CAJPJYC,1,one star,stop work month total junk,-0.296,0.355,0.645,0.0
557,RC14CXC3Q9WKX,3,adequate noisy,since use microwave heat reheat food decide forgo bell whistle last one stop work one low price one meet color size wattage wanted.<br pro heat food expected.<br con noisy<br microwave work fine intend purpose extremely noisy compare previous microwave occasionally make odd rumble sound may sit level since one leg short others attempt adjust leg without success tuck piece fold cardboard keep microwave somewhat level also first door extremely difficult push open gotten well use,-0.8483,0.166,0.788,0.046
558,R22040I6BN2SC,2,overheats minimal use,microwave overheats pop two three bag popcorn overheats automatically switch low power mode available thus make take forever heat anything let rest minute cool down.<br br microwave work well use much intensive use buy something powerful,0.6249,0.051,0.775,0.174
559,R2J4VTUI1XQN0U,1,one star,item dod work second open nox,0.0,0.0,1.0,0.0
560,R2OLO7UMMUEW0K,5,five star,really nice,0.4754,0.0,0.244,0.756
561,R2QUV0KLG38Y7U,1,year buy appliance bad purchase ever make,one bad appliance ever buy customer support issue horrendous non-existent recommend anyone consider unit finish kitchen match set samsung product forgo aesthetic get something else first others state control panel awful hard read button set way presumable keep someone push button unintended cleaning panel press hard exactly right spot feel go unit food spite revolve turntable heat evenly stainless steel odd reason difficult clean exterior stainless steel appliance company clean easily short time warranty expire unit fail work turn factory work do well circuit board loose connection cause short burn primary unit dealer tell warranty repair one repair people say defect warranty issue contact samsung use every excuse book finally say something along line allow ever pay pocket expense regardless cause end story end samsung later salesperson tell numerous complaint unit samsung tv's great never another one cheaply manufacture appliance,-0.8658,0.191,0.68,0.129
562,RJNTR3P11PET9,3,work fine hate push open button,work fine hate push open button end push whole microwave away....(you need use hand hold microwave place,0.0772,0.163,0.617,0.22
563,RA7T9DL1KN5HL,4,microwave fast easy use,grill toast well dedicate toaster oven microwave fast easy use fast preheat convection oven cook accurately perfect small household use air fry yet,0.8271,0.0,0.697,0.303
564,R3D38NWGN3FIJ0,5,super cute work great,super cute work great compact bowl plat fit little snug rotate plate otherwise fantastic,0.9524,0.0,0.345,0.655
565,R1AFAY6B0JXKY7,1,say fine go bought another microwave,unit go initial warranty expire unit listed year warranty magnetron magnetron main engine microwave jump thru hope week include take videos product shoot flame spark samsung warranty service tell service agreement near arkansas another week pass speak one phone finally agree partial refund send email confirming amount.<br say fine go bought another microwave never send refund call week later say provide part original microwave???.......easily do tell never say word either phone email.<br unit last longer feel stupid buy kitchen full samsung appliance if/when break deal deceptive people lack support again.....steer clear,0.8844,0.075,0.737,0.188
566,R1GEZTNGMZPBDV,4,four star,god model,0.2732,0.0,0.323,0.677
567,R2B8PKDAHON0Z,5,great product,fantastic product make microwave look brand new strong odor first day dry quick look great,0.9001,0.0,0.522,0.478
568,R36THGSJQMXR8N,1,one star,come huge dent side,0.3182,0.0,0.566,0.434
569,RPINQU6EY687P,4,four star,satisfy,0.4588,0.0,0.0,1.0
570,R36YDBEXGFB8T8,5,great microwave,love microwave need something could go new kitchen island want spend fortune something mediocre rating microwave mixed review work great household would say somewhat negative door slightly slow open compare regular microwave door open manually overall pleased purchase,0.8439,0.07,0.675,0.256
571,RJD8L4SVUCRIH,5,five star,heat great get hot,0.6249,0.0,0.423,0.577
572,R30CS2D74HKDNN,5,five star,nice size apartment,0.4215,0.0,0.417,0.583
573,R3STZQPYKZJZX5,5,best microwave i've ever own use,far best microwave i've ever own size price two reason form factor simplicity control use microwave heat leftover cook frozen meal make popcorn melt butter cheese thaw frozen meat reheat cold coffee freshen stale bread make crouton cook sausage hot dog etc use microwave several time per day think microwave usage pretty typical thing microwave prepare entrees scratch like cook roast casserole i've cook size frozen entree issue note review refers earlier model machine seem identical one replace it.<br br form factor gut machine cook chamber small possible footprint round back tucked corner countertop mean lose countertop furthermore awkward part countertop use prep work etc elbow would bang fridge every microwave i've ever own take prime useable countertop make huge difference usability appearance kitchen i'd give five star reason alone.<br br interior size machine big think round space useable round turntable entirely fill rounded shape interior advantage nothing fall corner cook i've occasionally thaw something big turntable side front microwave square possible problem.<br br control love love love simplicity control exactly everything need way completely intuitive simple mention emerson microwave office never yet beenable figure operate i'm least normal intelligence hat emerson lot button i'm sure lot thing need none matter i'm willing learn complex counterintuitive interface cook frozen lunch entree whirlpool however amazing power defrost reheat popcorn button well plus minus start stop accomplish everything plus minus start stop occasionally power.<br br operate press plus reach time want press start bam can't get easy time increment get large increase time absolutely problem use second increment minute second increment minute second increment six minute one minute increment fine i've never issue use minute instead minute cause meal fail pot pie call minute power they're fine either make popcorn always listen pop stop slow that's pop time depend much freshness moisture content kernel power microwave true every microwave similarly i'm thaw something pay attention progress fat content food hard frozen make difference time suspect fancy convention microwave thermal probe allow completely mindless use kind ultra high-end microwave want need.<br br i've use early model microwave three year absolutely problem can't speak specific reliability model mine layout control form factor etc would hesitate buy one facti'm tempt buy one office get rid annoy emerson,0.9766,0.086,0.771,0.143
574,R3502XBDHL0EOI,4,four star,gift sister happy,0.765,0.0,0.132,0.868
575,R2T9I2WBUVXEPY,5,five star,work great issue,0.6249,0.0,0.328,0.672
576,R2A1RHIYH9SQUU,3,want love microwave combo oven,want love microwave combo oven lack instruction use frustrate think trade cuisinart appear function come booklet detailed instruction,0.0516,0.214,0.565,0.222
577,R3DWYZQFJ8GCID,1,danger buy,two year microwave die yesterday involve black smoke luckily able manage mess whole house burn stay away company,-0.4767,0.259,0.607,0.134
578,RR92UT5QXQR96,5,five star,great buy,0.6249,0.0,0.196,0.804
579,R1RP5STHB2OSLK,3,like,small work well like,0.5574,0.0,0.303,0.697
580,R24IUFY6ZMRKO4,1,whirlpool lemon,purchase microwave february perfect size stop work within three month contact whirlpool via phone email tell whirlpool product review board dispose accordance law dealer live return take local metal disposal site provide proof compliance whirlpool whirlpool product review board promise repeatedly three-month period check would send purchase price apologize delay one time email buy back check order stuck system three month promise whirlpool stop communication two month pass since still receive buy-back check expect get one buy product see several review risk buying lemon case lose spend many many hour time money exactly whirlpool told collect warranty whirlpool apparently honor warranty least product.<br br p.s day review posted whirlpool issue refund check,0.1027,0.106,0.793,0.101
581,R1E7LAIG3WUF9U,4,great fit family,little loud great fit family,0.7234,0.0,0.331,0.669
582,R14MS5UL9B09MX,5,five star,perfect apartment,0.5719,0.0,0.213,0.787
583,RSR73GAU4K6VY,4,unit work great category,direct replacement rv original lasted year hope get life one previous review spot fact new one hard get two mounting bolt start take minute new model fan motor far louder old one unit work great category,0.8807,0.032,0.705,0.264
584,R16ASFCV1UG3HO,5,pleased put unit inside cabinet,pleased put unit inside cabinet slide shelf one less thing expose kitchen,0.3774,0.093,0.703,0.204
585,R34PFW1NK782KD,3,three star,door hard open microwave shut couple time mos old wait see happens,-0.1027,0.113,0.887,0.0
586,RPRAMCCSPBW7X,5,good reliable model,one almost yrs good reliable model,0.3862,0.0,0.656,0.344
587,R2IQMB4IO2ZIL6,5,job look nice happy big,say microwave job look nice happy big plus deliver right door hunt around carry auto,0.7579,0.0,0.667,0.333
588,R1ES7WGUKUODS8,5,five star,seem good quality,0.4404,0.0,0.408,0.592
589,R1IUX33P1ZXF78,3,result may vary,paint seem work well depend upon paint microwave like mine turntable factory paint wear path little wheel turn glass table note oven least year old read paint can's direction thoroughly scrap old loose paint rust paint say use well-ventilated area suggest wait nice low-humidity day use paint outdoors smell quite bad make sure allow paint dry thoroughly bring indoors also wait hour re-installing turntable use microwave.<br br result within month paint worn turntable wheel i'm back start painting guess repaint someplace get wear paint work fine turntable wheel much.<br br prevention advice make sure microwave oven clean dry use food potato generate lot steam/moisture oven drain turntable always notice moisture that's cause rust first place,0.8111,0.065,0.791,0.144
590,R2RVO54YYW9VOJ,5,five star,replace sharp microwave take minute turntable work,0.0,0.0,1.0,0.0
591,R1NJ9ZP8WVOQH4,5,great microwave,awesome replacement great quality bell whistle,0.8481,0.0,0.328,0.672
592,R2SEYAMD3EGFUL,5,ge microwave oven work like new,put old ge spacemaker microwave oven work perfect replacement number,0.6124,0.0,0.615,0.385
593,R2MRNNN4E3C2P7,5,fit well corner cabinet,love size design month still work well issue,0.743,0.0,0.488,0.512
