,review_id,star_rating,review_headline_clean,review_body_clean,compound,neg,neu,pos
933,R3DB1N7TM3YUFD,5,save packet,microwave rust badly undercabinet attach microwave want buy new one fit small spot want remove microwave paint couple hour clean microwave direction online cover surface overspray use paint new microwave keep clean sock fill rice use rice absorbs moisture microwave rust happy,0.8442,0.059,0.669,0.272
934,R308NHF9TSNCHE,2,convection oven subpar,we've convection oven year pretty happy microwave portion convection feature satisfactory small volume compare regular range would assume oven heat faster even need preheat use previous model kitchenaid model take actually twice long regular oven therefore hardly use convection feature look good convection oven,0.9062,0.0,0.765,0.235
935,RA52BNOP5RSGS,5,great space saver,small kitchen old microwave full size microwave take large amount cabinet space seem place size shop around find small sized unit hesitant watts old unit watt however find cooking time unit insignificantly longer old microwave second thing actually cook use warming leave over frozen snack etc use perfect attractive addition kitchen rather huge distraction need small size microwave highly recommend one,0.8173,0.08,0.735,0.184
936,RDMEJ35HNGDW9,5,product great,really enjoy drawer type microwave auto open feature plus.<br come full warranty even though refurbish model,0.5413,0.0,0.811,0.189
937,R39C3IJ675ESEF,3,work great except anoying beep,everything work perfectly several month use look great pretty smart however annoy continuous error beep,0.8625,0.194,0.313,0.493
938,R2OK4UWKM5XFCT,1,door handle broken,less year door handle fell hold onto microwave door cheap plastic part,0.0,0.0,1.0,0.0
939,R1E870QQGMHIG0,4,nice money,buy microwave fit cabinet measurments important everything want microwave oven full size fit big plate carousel work great easy control several one push button even sec button readout bright easy see problem cabinet get via ups pack inside plain brown box inside box box microwave ship box full surround think styrofoam block along plastic paperwork take wrap cabinet load dent one side slightly collapse know could happen unless do shipping would ship something knew beat reason think is......people buy put cabinet like pay great work microwave terrible cabinet,0.9259,0.115,0.643,0.242
940,R15QDMH9BCIO1A,5,favorite microwave,go say despite size wonderful microwave think small size best part buy small kitchen adorable kick as machine love,0.8625,0.101,0.507,0.392
941,R1S1P0HL8FOTK9,5,described,part describe arrive timely fashion installation easy direct replacement magnetron year old ge spacemaker microwave work,0.4404,0.0,0.838,0.162
942,R1SWYOR5NMC2IL,1,horrible,return receive less half pay bulky odd shape difficult find suitable space like old tv counter ugly ugly,-0.8411,0.463,0.444,0.093
943,R1YD2YPDBAX3XH,5,great,go replace microwave check find magnetron order deliver fast fixed buck,0.0,0.0,1.0,0.0
944,R1Q2Q0RUDQ8R4D,3,gutless,microwave great portability also defrost meat well without it.<br look good kitchen good basic use long hurry.<br power compare full size one.<br take second old panasonic take minute one thats reheat cup coffee.<br keep old micro plug basement need large thing heat quicker hot.<br reheat leftover take much longer point get thing heat quickly microwave you.<br annoy beep continuously go every second something heat open door like need remind another electronic noise nobody needs.<br expensive get pay portability,0.1501,0.103,0.799,0.098
945,R10UAJIB4R2G0R,1,stay away whirlpool product junk,get whole suite whirlpool appliance new house every piece fridge dishwasher microwave give grief never end service call month use fall apart oven nice display however cook door suck water vapor cook top moisture sit hour electronics hook outside vent however blow hot air back kitchen instead pipe wall technician look weekend save aggravation samsung high quality brand whirlpool quality history point,0.1779,0.086,0.804,0.11
946,R1U3YT1X6MHFBA,1,got year,nice look microwave many problem last exactly year replace since range model mean may cook thing range create steam steam rise get electronics keyboard short replace keyboard yr forget cost cheap finally finally die poorly design recommend,-0.2732,0.181,0.661,0.158
947,R2CZGB89UBS5ZQ,2,almost immediate regrettable purchase,i've less month full disclosure purchase amazon get exact model best buy read review first instal good look nice stainless steel finish must kind coat much easy clean steel appliance overall size decent inside cook say quiet microwave i've ever own not-so-good i've never over-the-range microwave handle door really give feature much thought make purchase look nice handle get untouchably hot cook stove think i'd ever buy another handle kind nuisance use oven mitt open microwave even nuisance forget use mitt put hand hot stainless steel hard see inside food cook there's one bulb quite dim plus door screen-printed pattern make even hard see exhaust fan range technically two setting sound almost identical loud microwave run long period time start get overheat stove fan automatically turn smart feature prevent overheat fan super loud can't manually turn kick bad oh god freakin beep do cook insane i've never ever microwave stop beeping upon door open continue beep extremely loud least second long open door timely fashion remind gentle short beep instead get ear-shattering yokoono-screeching beep every minute i've find hit stop/cancel button open door it'll stop beep another nuisance i've never deal previous microwave bad thing i've find touch pad scratch extremely easily use microfiber cloth still look like go steel wool cover broken glass try use plastic/fiberglass polish thing however i've find use granite countertop cleaner/polish least minimizes look scratch bite overall i'd advise people purchase model negative outweigh positive especially many good choice,0.9896,0.078,0.705,0.217
948,R3QAYNVKOBFL3F,5,great product,really think built-in microwave go replace paint peal away rust form exposed amazement inexpensive product solve problem ease remember area well vent outside use mask use many light spray prevent run,0.7184,0.103,0.615,0.282
949,R1M4XTLS090SFH,5,great microwave,i've microwave instal new kitchen want find one could go island detract new cabinet easy use great addition new kitchen,0.8074,0.0,0.672,0.328
950,R1W99WVF5JEK9T,4,ge microwave oven magnetron diode kit solve issue,part need correct part identify variation therefore instal like part remove work fine since instal,0.5106,0.0,0.751,0.249
951,R39RXQLH8PGL35,5,microwave oven,microwave oven purchase work everbody like never problem would purchase kind next time,0.7997,0.0,0.551,0.449
952,R5J87FRLU1U8R,1,work right,microwave spark heat send back replacement hope work time,0.5859,0.0,0.593,0.407
953,R604ISO4MZRYH,4,work fine,work great ship everthing good look really nice oven microwave could microwave work go,0.8777,0.0,0.522,0.478
954,RW3LUJP65YQ6L,5,compact great,microwave take half space previous fit corner interfere wi-fi!<br put magnetron beneath microwave make compact,0.4199,0.0,0.834,0.166
955,R2NIN11WLAEUNE,2,broken month,like form fit well corner counter fairly weak strength adequate heating bowl food big issue dead month use still try get whirlpool fix replace customer service stellar day contact still try reach person need,0.4767,0.155,0.559,0.286
956,R22ZZ4XQICS6IG,1,buy microwave,issue keypad go dark soon press start error code come samsung would fix want pay repairman come fix review would think would want fix save reputation never buy samsung tv also issue know would fix pay repairman might well get new microwave price samsung,0.34,0.109,0.734,0.157
957,R3P8SJEOI6R6P8,5,love drewer,buy new construction use yet look great hope work well,0.8442,0.0,0.435,0.565
958,R245MU1ZCJQ77G,5,great price,despite high percentage negative review recently buy unit replace similar frigidaire unit develop magnetron failure year heavy use can't understand bad review regard user interface possibly seem odd always turn beep annoys you.)<br br course unhappy reviewer fails quickly good experience previous one decide take chance also get much good review lot place much large reviewer far love much predecessor i'll report back conk quickly,0.5924,0.163,0.629,0.208
959,R24211W83A7KND,1,unreliable horrible customer service ge product,review much product consumer report buy new appliance new cabin build used consumer report recommendation buy appliance one purchase give excellent review consumer report people!!!<br br last year quit work ge want look tell much part labor charge repair buy another company's cu ft stainless steel countertop microwave today brand new full warranty ah...no thanks!<br br old year old panasonic still work great heat food well one good think i'll take advice instead consumer report buy another panasonic!<br br update find inverter board bad...ge want new part service trip charge another repair total repair cost microwave oven year old one brand new,0.9389,0.0,0.853,0.147
960,R1P4474IKHU51N,4,good microwave small kitchen price,microwave really ok price need fancy big microwave use basically warm dish perfect!<br try also thaw meat prepare popcorn also work well.<br con little bit noisy end preparation popcorn button work well program need choose repeat make sure popcorn popped<br pro easy use small built-in kitchen timer cheap,0.8612,0.026,0.758,0.216
961,REJSE007FGB2H,5,trick,microwave leftover fit corner relatively small footprint that's ask wish come low profile plug figure way make work,0.4767,0.094,0.673,0.233
962,R2S78J70CDQK3H,5,nice little unit,microwave excellent small household person complex cook full-plate size fine heat-ups small casserole dish best way fit corner yes take space fit cabinets leave counter space control easy set microwave year somebody suggest i'm happy,0.9712,0.023,0.508,0.469
963,R3EBFTG5TWR8ER,1,ge profile buy,among problem mention glass panel door shatters convection oven go degree even think instal new door ge insist repair people work plus cost door zero star would totally appropriate,-0.4019,0.088,0.912,0.0
964,R2XGJXGAE3SRAY,3,fan malfunction random time,fan come random time turn unplug microwave happen several time period couple month occasionally start happen year use happen recently probably last month hopefully return fan also fairly loud point elevate voice carry conversation everything else average sure look nice foolish enough buy would give one star fact work around problem unplug plug back get fan turn live noise make,0.836,0.067,0.727,0.206
965,R3387Y8CZVXYR4,1,inferior product,initially impressed oven less three month trouble reviewer say oven turn plastic exterior crack due heat range whirlpool make customer satisfaction priority despite numerous complaint oven oven ultimately replaced builder builder warranty guarantee replacement oven brand new also crack continue malfunction intermitently whirlpool recall garbage offer replacement think legally certainly morally wrong continue sell inferior overprice potentially dangerous product especially since notify problem document repair company contract service thing.<br br thoroughly disappointed product lack customer support whirlpool,-0.7067,0.203,0.632,0.164
966,R2PMCNSJZEG9X6,4,microwave,good unit<br easy install replace old unit<br color expect open,0.7003,0.0,0.58,0.42
967,R383AGH8CJZHPI,2,damage,door huge dent make suspicious product factory second something return another purchaser,-0.0516,0.169,0.676,0.155
968,R36NXL60OBCP1H,5,excellent small space,small microwave everything need even without lot bell whistle fit corner necessary good job large microwave easy clean i'm please decision,0.9062,0.0,0.546,0.454
969,R3LZ1X8GINCBE6,1,poor design dead year,heat lunch cycle end fan light turn table turn heat keep go way make stop unplug seem like many people issue couple year read forum control board issue cost around piece crap poor design also timer useless feature annoy stay away product,-0.8316,0.255,0.655,0.09
970,R3JM24X0EN9YDC,4,nice little microwave,purchase microwave husband's semi truck would run large inverter instal truck fought several day decide would work great home love take little room counter perfect one two person household,0.8869,0.059,0.64,0.301
971,R20J6PX3XEUE7Q,3,steam stove ruin,buy samsung oven microwave sears look nice work well.<br br warn steam pot control panel extend time moisture ruin control panel.<br br cook homemade soup burner control panel steam cooking long ruin part panel never work get code try turn look internet indicated moisture damage something careful,-0.7964,0.209,0.686,0.105
972,R3DVD9863AY0YN,2,major design flaw,love microwave answer clean glass door cover food clean always cover food yet sometimes saran wrap break thing splatter could put fine grate food glass expect food splatter beyond samsung make great tv's electronics stay away appliance obviously clue meantime pay top dollar think great product little know i'm stick something make look like i'm total slob kitchen thanks samsung,0.9761,0.018,0.639,0.343
973,R2JEJAMVBRMB16,4,compact efficient,love new microwave fit perfectly small counter efficient need heat cup heat pad negative plastic cover bottom front panel start deteriorate already i've couple month otherwise love,0.9349,0.087,0.493,0.42
974,R1VNZRE22N2UZW,1,microwave bust,absolutely cannot believe experience microwave model take freak shelf already recall issue within month one replace unit explodes horrible electric crack sound run electrical short fry insides microwave later call warranty man buy model,-0.7506,0.167,0.833,0.0
975,R1BWH3ZFGPJWTB,5,look great,microwave simple use work great first little apprehensive matt finish get installed look great love husband instal it...we need basic drill take couple hour get do,0.9246,0.0,0.65,0.35
976,R23IVVJUMW92QN,1,garbage,issue trina review purchase via usa ship canada via freind manufacture oct use time die sharp basically tell take hike cross border warranty kitchen reno even do thing already fail cost fix garbage product garage service garabge company stay away,-0.8126,0.163,0.837,0.0
977,RQMJZE05H42DY,5,love microwave,love microwave heat food drink fast love love love compact size counter top clutter one pet peeves~so definitely open counter space cute,0.9758,0.0,0.382,0.618
978,R3MQFYBU220JU8,1,boo...hiss,come townhouse buy may jan dead date manufacture july come buy another read reviews....thank know replace different brand even year old unfortunately previous owner buy whole shebang brand/model oven fridge dishwasher...ahhhhh....that bode well hopefully microwave bad i'll get use rest frigidaire electrolux company thanks reviews.<br beth,-0.5423,0.176,0.691,0.133
979,R2EZWEW7PXCVTU,5,touch,need touch up<br work great keep<br hand see another chip<br fix,0.8074,0.0,0.552,0.448
980,R7JYVC5V7H01R,4,want,microwave perfect perfect folk would think little loud run beeper take little long heat large unit that's expect minor issue right size fit nicely dead space corner free counter top space heat freeze food fine that's use ask need improve i'd like able key heating time rather push button backlighting button overall fit need,0.9661,0.057,0.559,0.383
981,R12BW3IESY27E0,2,last,microwave approximately year quit heavy difficult install direct vent must turn vent around prior mount bad part last,-0.7184,0.273,0.727,0.0
982,R2DUKAK9VR1KHF,5,happy,unit arrive quickly good order take little time wife mount wall instruction adequate set mount etc.<br br work perfectly can't think anything complain except another reviewer comment design flaw proper cover exhaust vent top small item could fall area would agree though case there's nothing would fall,0.9044,0.038,0.694,0.267
983,R3OW21UERO3YBZ,5,fantastic space saver look,oh gosh fantastic save sooooo much counter space family suit perfectly one big stainless microwave take much counter space.<br side cannot type specific time something heat press start button automatic second press twice week really miss number bad i'd rather save space,0.8785,0.1,0.62,0.28
984,RZ9MBA5BZUHVY,5,omg thing knockout,we've big ol massive ge microwave powerful enough cook buffalo big enough fit beast inside redesign kitchen put new pro-style stove elegant curve glass vent oversized radar box go get replace looked allegedly compact countertop unit reject every one not!<br br find whirlpool tv set er mean microwave whomever design deserves nobel prize peace physic common sense look like cute little old school tv set imagine cute microwave oven what's even well thing disappears right corner new countertop somehow figure use corner design advantage here's best place full-size dinner plate inside how'd that??!!<br br negative nothing terrible yes watts vs former machine another reviewer say cause fit turkey power cook mean ya use microwave vegetable egg liquid popcorn new cute whirlpool tv/microwave thingee fine take extra second low power give little extra time stare awesome box marvel truly cool is.<br br speak box serious out-of-the-box thinking appliance fit lifestyle major kudos whirlpool take initiative see thing little different steve job would love microwave form style perfectly match function time lazy manufacturer game.<br br bottom line outstanding microwave,0.9952,0.072,0.618,0.311
985,R2GG7YYQBEXHZG,1,go flame,buy microwave little year ago okay really like way function compare previous microwave own look good worked fine yesterday.<br br nowhere go flame even use time.<br br one house yr old mother-in-law say notice earlier morning display microwave unable use unplug later house fill smoke smoke flame shoot top vent microwave say much smoke could even see kitchen call fire dept dispatch exit home time arrive fire burn damage contain internals microwave fire crew remove microwave home inspect home insure microwave indeed cause fire thankfully damage home microwave strong odor smoke burn plastic i'm sure take week get rid smell).<br br contact samsung report happen await response executive customer relation dept nature incident.<br br i'm really sure want anything create awareness maybe issue recall base negative review read amazon would encourage others problem model report samsung may much good know could save life something.<br br update samsung executive customer relation department contact mlk holiday telephone cell phone ask provide microwave serial number agree would provide via email short time later receive email ask provide serial number samsung would like locate service center diagnose unit respond later day serial number.<br br receive response state base serial number provide microwave warranty due nature problem samsung cover cost diagnostics service center contact me.<br br receive call service center inform receive service order samsung state microwave warranty responsible payment ask double check samsung say would contact sent email explain service center say hour later samsung respond one time accommodation labor assume also send service center.<br br day later service center contact explain receive accommodation samsung ask could deliver microwave agree mile home).<br br service center contact explain several part microwave short circuit required replacement explain accommodation diagnostic labor repair would responsibility ask direction explain part require expensive repair would likely exceed cost replacement.<br br send another email samsung explain call service center explain make point buy appliance well know major brand samsung expectation high quality long life ask give fact unit fail due short circuit short life normal residential use consider replace microwave cost despite fact warranty period end mention almost burn house down.<br br hour sense email sent receive response samsung instruct service center recycle microwave hear otherwise samsung monday today friday).<br br get response samsung update review.he microwave cost despite fact warranty period end mention almost burn house down.<br br hour sense email sent receive response samsung instruct service center recycle microwave hear otherwise samsung monday today friday).<br br get response samsung update review,0.9485,0.067,0.811,0.122
986,R2XFK5PNK6M6SS,5,trick,make manufacture ge spacemaker work like new man lot different shell depend year make small round diode-like item attach side original unit replacement simply move location replacement connect thing back trick also replace small include diode connects capacitor...why there.<br br whole deal take hour start finish include remount unit range go neighbor thanks neighbor get help remove remount microwave lot videos web help along way patient keep track screw,0.8885,0.033,0.798,0.169
987,RW04SRDCYLZWP,1,want wait week new microwave repair choose one,initially happy purchase microwave although feature older expensive dacor microwave replace size great like easy clean interior.<br br however six month purchase right christmas fail totally would power call samsung customer service say tech would get touch shortly day local repair company call say come area week would several day could stop we're mile salt lake city park city major resort town winter population people like we're sticks.<br br nine day call repair service show repair one part state magnetron damage would need take microwave shop diagnosis repair would order part would bring back route bring area two week least assume samsung part stock way door bang microwave door frame put major dent it.<br br call samsung customer service state thought three week long repair unit blame tech bringing part might need whole microwave refuse offer even expedite part repair shop cut week time let alone discuss kind replacement.<br br family use microwave multiple time day samsung good quality first place failure need good repair support system place can't well week repair appliance get use daily that's good enough need failure like right family come holiday would happy spend week giant empty space kitchen microwave oven hood was?<br br samsung appliance good luck samsung take whirlpool bosch asko panasonic etc appliance house work great daily use year i'm store another brand microwave look one ebay still warranty!<br br way try post version review edit accordance samsung.com's review guideline samsung.com samsung supposedly allow customer rate product microwave currently star review receive notice today would post review--no rationale meet standard buyer beware,0.9808,0.089,0.738,0.173
988,RPJI2KKQEPLV2,1,catch popcorn fire die,buy house unit house.<br br look good control awkward timer fast button control intuitive.<br br however work fine light fan work ok.<br br wife cook popcorn init flame wife throw burn popcorn bag sink clean unit fail start all.<br br never anything flame microwave especially metal tin-foil involve fear replace brand look other.<br br definately would steer clear unit seem multiplel issue,0.4588,0.111,0.724,0.165
989,R4HWP8PKM1MN4,5,great product,great product fix microwave like brand new would highly recommend anyone paint chip side top microwave,0.8805,0.0,0.517,0.483
990,R353IUZDJCLC7A,1,receive dented unit,know purchase refurbished unit noticeable dent face unacceptable i'm return unit,-0.4588,0.231,0.769,0.0
991,R17NTD4IO6F622,5,love,great microwave combination convection oven knob dial actually nice initially hesitant get wife truly love,0.9186,0.077,0.385,0.538
992,R2LJRIVX8BEZ95,4,super small size,feturers big microwave compact size<br handle make easy open without spill food,0.4404,0.0,0.791,0.209
993,R3CM5ODB9W18L7,3,good bad,price can't beat feature want however noisy door difficult open practically punch toggle hold unit leave hand push switch right i'm hop get easy time,0.3565,0.209,0.599,0.192
994,R1D00ZLZNTFKZO,2,start ail month die month,microwave look great really like feature also unique footprint work well kitchen limit counterspace last longer month month start make labor noise minute month catch fire try warm cup coffee next microwave buy something look less sexy less money hope durable,0.922,0.045,0.641,0.313
995,RUBOK7O88DIKI,5,best small microwave,need small microwave move small condo little counter space review say perfect solution take little room plus fit easily corner rotate glass tray hold standard size dinner plate tall enough fit ounce mug room spare shorter many standard microwave digital control simple work fine we're old actually really appreciate simplicity thing take long cook much.<br want bell whistle able zap thing quickly microwave hand need small microwave easy use sturdy definitely recommend one love,0.9841,0.0,0.639,0.361
996,R2U62Q6MUMF9LA,1,terrible product useless company,terrible product brand microwave less two year worthless turntable turn unit heat thing call lg refuse give help assistant,-0.6412,0.31,0.585,0.105
997,RPLQHZIQ2L9XY,1,stop work week,use microwave week stop work send back wait replacement give sharp chance,-0.0516,0.155,0.704,0.141
998,R2EMLEIZCHRFFG,5,perfect fit,need microwave deep bit wide fit cabinet struggle find right dimension build cabinet cubby one perfect fit concern would powerful enough since watt low many others far work great needs plus look great space,0.946,0.088,0.519,0.393
999,R3GVR7JL38HGCD,4,others say,use microwave much want invest counter space one.<br br teenager heat thing make sense get one small-footprint model seem good fit handle large dinner plate seem heat thing well little taller look picture fit family's need quite well,0.886,0.0,0.705,0.295
1000,R3ALI4LCVYF0P1,5,great product,need create little space kitchen counter unit perfect nice look machine tuck corner would recommend others,0.8779,0.0,0.519,0.481
